{
  "@context": "http://qiicr.org/dcmqi/contexts/dcmqi.jsonld",
  "id": "https://raw.githubusercontent.com/qiicr/dcmqi/master/doc/schemas/pm-schema.json#",
  "$schema": "http://json-schema.org/draft-04/schema#",
  "required": [
    "AnatomicRegionSequence",
    "FrameLaterality",
    "QuantityValueCode",
    "MeasurementUnitsCode",
    "DerivationCode"
  ],
  "additionalProperties": false,
  "properties": {
    "@schema": {
      "type": "string"
    },
    "SeriesDescription": {
      "allOf": [
        {
          "$ref": "https://raw.githubusercontent.com/qiicr/dcmqi/master/doc/schemas/common-schema.json#/definitions/LO"
        }
      ],
      "default": "Parametric map"
    },
    "SeriesNumber": {
      "allOf": [
        {
          "$ref": "https://raw.githubusercontent.com/qiicr/dcmqi/master/doc/schemas/common-schema.json#/definitions/IS"
        }
      ],
      "default": "300"
    },
    "InstanceNumber": {
      "allOf": [
        {
          "$ref": "https://raw.githubusercontent.com/qiicr/dcmqi/master/doc/schemas/common-schema.json#/definitions/IS"
        }
      ],
      "default": "1"
    },
    "BodyPartExamined": {
      "allOf": [
        {
          "$ref": "https://raw.githubusercontent.com/qiicr/dcmqi/master/doc/schemas/common-schema.json#/definitions/CS"
        }
      ],
      "default": ""
    },
    "QuantityValueCode": {
      "$ref": "https://raw.githubusercontent.com/qiicr/dcmqi/master/doc/schemas/common-schema.json#/definitions/codeSequence"
    },
    "MeasurementUnitsCode": {
      "$ref": "https://raw.githubusercontent.com/qiicr/dcmqi/master/doc/schemas/common-schema.json#/definitions/codeSequence"
    },
    "MeasurementMethodCode": {
      "$ref": "https://raw.githubusercontent.com/qiicr/dcmqi/master/doc/schemas/common-schema.json#/definitions/codeSequence"
    },
    "ModelFittingMethodCode": {
      "$ref": "https://raw.githubusercontent.com/qiicr/dcmqi/master/doc/schemas/common-schema.json#/definitions/codeSequence"
    },
    "DerivationCode": {
      "$ref": "https://raw.githubusercontent.com/qiicr/dcmqi/master/doc/schemas/common-schema.json#/definitions/codeSequence"
    },
    "DerivationDescription": {
      "type": "string",
      "default": ""
    },
    "SourceImageDiffusionBValues": {
      "type": "array",
      "minItems": 1,
      "items": {
        "type": "string"
      }
    },
    "RealWorldValueSlope": {
      "$ref": "https://raw.githubusercontent.com/qiicr/dcmqi/master/doc/schemas/common-schema.json#/definitions/FD",
      "default": "1.0"
    },
    "AnatomicRegionSequence": {
      "$ref": "https://raw.githubusercontent.com/qiicr/dcmqi/master/doc/schemas/common-schema.json#/definitions/codeSequence"
    },
    "FrameLaterality": {
      "$ref": "https://raw.githubusercontent.com/qiicr/dcmqi/master/doc/schemas/common-schema.json#/definitions/CS",
      "default": "U"
    }
  }
}
