{
  "SeriesDescription": "Parametric map",
  "SeriesNumber": "300",
  "InstanceNumber": "1",
  "BodyPartExamined": "Prostate",
  "AnatomicRegionSequence": {
    "CodeValue": "41216001",
    "CodingSchemeDesignator": "SCT",
    "CodeMeaning": "Prostate"
  },
  "QuantityValueCode": {
    "CodeValue": "126312",
    "CodingSchemeDesignator": "DCM",
    "CodeMeaning": "Ktrans"
  },
  "DerivationCode": {
    "CodeValue": "126312",
    "CodingSchemeDesignator": "DCM",
    "CodeMeaning": "Ktrans"
  },
  "MeasurementUnitsCode": {
    "CodeValue": "/min",
    "CodingSchemeDesignator": "UCUM",
    "CodeMeaning": "/min"
  },
  "DerivationDescription": "",
  "RealWorldValueSlope": "1",
  "FrameLaterality": "U"
}
