{
  "@schema" : "https://raw.githubusercontent.com/qiicr/dcmqi/master/doc/schemas/pm-schema.json#",

  "SeriesDescription": "Apparent Diffusion Coefficient",
  "SeriesNumber": "701",
  "InstanceNumber": "1",
  "BodyPartExamined" : "PROSTATE",

  "QuantityValueCode": {
    "CodeValue": "113041",
    "CodingSchemeDesignator": "DCM",
    "CodeMeaning": "Apparent Diffusion Coefficient"
  },
  "DerivationCode": {
    "CodeValue": "113041",
    "CodingSchemeDesignator": "DCM",
    "CodeMeaning": "Apparent Diffusion Coefficient"
  },
  "MeasurementUnitsCode": {
    "CodeValue": "m2/s",
    "CodingSchemeDesignator": "UCUM",
    "CodeMeaning": "m2/s"
  },
  "MeasurementMethodCode": {
    "CodeValue": "113250",
    "CodingSchemeDesignator": "DCM",
    "CodeMeaning": "Mono-exponential diffusion model"
  },
  "SourceImageDiffusionBValues": ["0","1400"],
  "AnatomicRegionSequence": {
    "CodeValue": "41216001",
    "CodingSchemeDesignator": "SCT",
    "CodeMeaning": "Prostate"
  },
  "FrameLaterality" : "U",
  "RealWorldValueSlope" : "1"
}
